作家,皇帝纪年,公元年,月,日,古一级地名,古二级地名,古三级地名,地点名胜,今活动地省,今活动地市、县,职官,活动,交游,系年作品,体裁,来源,备注1,备注2,备注3,录入者,城市
苏味道,武后天授元年庚寅,704,3.0,,关内道,坊州,,,陕西,黄陵,刺史,在凤阁侍郎、同凤阁鸾台三品任。三月，贬坊州刺史,,,未知,"陈冠明《苏味道、李峤年谱》中央文献出版社,2000年版，第53页",,,,杨洁,延安
李白,玄宗开元十八年庚午,730,,,关内道,坊州,中部,,陕西,黄陵,,冬游坊州，有诗酬答友人,,《酬坊州王司马与阎正字对雪见赠》,诗 ,吕华明、程安庸、刘金平《李太白年谱补正》第156页,,,,黄威,延安
李白,玄宗开元十八年庚午,730,,,关内道,坊州,中部,,陕西,黄陵,,冬游坊州，有诗酬答友人,,《留别王司马嵩》,诗 ,安旗主编《李白全集编年笺注》第138页,,,,黄威,延安
武元衡,德宗兴元元年甲子,784,,,关内道,坊州,中部,,陕西,黄陵,掌书记,五月后，入鄜坊幕任掌书记,,,未知,赵目珍《<诗人主客图>“瑰奇美丽主”武元衡年谱》第92页,,,,许文可,延安
武元衡,德宗兴元元年甲子,784,,,关内道,坊州,中部,,陕西,黄陵,掌书记,在中部，五月后，有碑记,,《唐咸宜公主碑》,文 ,赵目珍《<诗人主客图>“瑰奇美丽主”武元衡年谱》第92页,,,,许文可,延安
