id,title,poet_id,content,year,genre
4180,代安平公遗表,83,随重表叔崔戎至兖州，掌奏章，有文,834,文
4181,安平公诗,83,表叔崔戎卒，有诗,834,诗
4182,过故崔兖海宅与崔明秀才话旧因寄旧僚杜赵李三掾,83,与崔明秀才过故崔兖海宅话旧，有诗寄旧僚杜赵李三掾,834,诗
4183,《东平路作三首》,83,漫游齐鲁，有诗,739,诗
4184,《送蔡少府赴登州推事》,83,在汶阳，有诗送友人赴任登州,745,诗
4185,《五月东鲁行答汶上翁》,83,五月，因许氏夫人去世，移家东鲁，寓居任城。有诗,740,诗
4186,《咏邻女东窗海石榴》,83,在任城，有诗,740,诗
4187,《早秋赠裴十七仲堪》,83,在任城，有诗赠友人,740,诗
4188,《大庭库》,83,在任城，有诗,740,诗
4189,《赠瑕丘王少府》,83,在任城，有诗,740,诗
4190,《赠范金乡二首》,83,在任城，有诗,740,诗
4191,《鲁城北郭曲腰桑下送张子还嵩阳》,83,在任城，有诗,740,诗
4192,《送鲁郡刘长史迁弘农长史》,83,在任城，有诗,740,诗
4193,《古风》其十（齐有倜傥生）,83,在任城，有诗,740,诗
4194,《古风》其十一（黄河走东溟）,83,在任城，有诗,740,诗
4195,《嘲鲁儒》,83,在任城，有诗,740,诗
4196,《客中行》,83,在任城，有诗,740,诗
4197,《送韩准裴政孔巢父还山》,83,冬，结识韩准、裴政、孔巢父。有诗,740,诗
4198,《送方士赵叟之东平》,83,寓居东鲁，有诗赠别友人,741,诗
4199,《东鲁见狄博通》,83,寓居东鲁，有诗,741,诗
4200,《送薛九被谗去鲁》,83,寓居东鲁，有诗送别友人,741,诗
4201,《别鲁颂》,83,寓居东鲁，有诗,741,诗
4202,《赠从弟冽》,83,寓居东鲁，有诗赠人,741,诗
4203,《捣衣篇》,83,寓居东鲁，有诗,741,诗
4204,《答友人赠乌纱帽》,83,寓居东鲁，有诗,741,诗
4205,《对雪奉饯任城六父秩满归京》,83,还归任城，有诗,744,诗
4206,《赠任城卢主簿潜》,83,在任城，有诗,744,诗
4207,《怀仙歌》,83,有诗，或在济宁作,744,诗
4208,《古风》其二十（昔我游齐都）,83,有诗，或在济宁作,744,诗
4209,《古风》其十九（泣与亲友别）,83,有诗，或在济宁作,744,诗
4210,《古风》其二十（在世复几时）,83,有诗，或在济宁作,744,诗
4211,《感兴》其五（十五游神仙）,83,有诗，或在济宁作,744,诗
4212,《任城县厅壁记》,83,在任城，有文,750,文
4213,《崇明寺陀罗尼幢颂并序》,83,在任城，应鲁郡崇明寺僧人之请，作文,750,文
4214,《忆旧游寄谯郡元参军》,83,居任城，有诗,751,诗
4215,《寄王屋山人孟大融》,83,在鲁郡，有诗寄友人,751,诗
4216,《鸣皋歌奉饯从翁清归五崖山居》,83,居东鲁，送李清，有诗,751,诗
4217,《与任城许主薄游南池》,83,游齐赵，至兖州有诗,740,诗
4218,《对雨书怀走邀许十一簿公》,83,游齐赵，有诗,740,诗
4219,《金乡薛少府厅画鹤赞》,83,在金乡，有文,740,文
4220,《金乡送韦八之西京》,83,在金乡，有诗,745,诗
4221,《酬张卿夜宿南陵见赠》,83,在南陵，有诗,742,诗
4222,《南陵别儿童入京》,83,玄宗召入京，遂返南陵，秋，受诏入京，有诗,742,诗
4223,《大庭库》,83,登大庭库，有诗,745,诗
4224,卢溪别人,83,贬谪龙标途中，在卢溪与友人分别作诗,749,诗
4225,留别司马太守,83,贬谪龙标途中，在卢溪与友人分别作诗,749,诗
4226,箜篌引,83,贬谪龙标途中，在卢溪与友人分别作诗,749,诗
4227,送吴十九之沅陵,83,贬谪龙标途中，近龙标时，作诗送友人,749,诗
4228,别皇甫五,83,贬谪龙标途中，遇贬谪到溆浦的皇甫岳，作诗,749,诗
4229,《解惑》,83,在循州任，迁葬王处士时作文以解人所惑,810,文
4230,《宴戎州杨使君东楼》,83,永泰元年去成都之嘉戎，六月间作是诗，楼上有感，应惊身老。宴戎州杨使君东楼,765,诗
4231,《阻戎泸间群盗》,83,自嘉州罢官东归，在戎州、泸州间遇群盗，滞留戎州，有诗。,768,诗
4232,《青山峡口泊舟怀狄侍御》,83,自嘉州东归，经青山峡口，泊舟，思狄博济，有诗。,768,诗
4233,《楚夕旅泊古兴》,83,秋，自嘉州东归，沿长江东行，泊舟，发思古之，有诗。,768,诗
4234,《移摄太平寄前李明府》,83,许浑移摄太平令，有诗寄前任县令李明府,841,诗
4235,《将归姑熟南楼饯送前李明府》,83,许浑移摄太平令，送别前任知县李明府，有诗,841,诗
4236,《移摄太守寄汝洛旧游》,83,许浑移摄太平令，有诗寄汝洛旧游,841,诗
4237,《将赴京题陵阳王氏水居》,83,秋，许浑自摄太平令任内擢为监察御史。将赴京上任，有诗题陵阳王氏水居,841,诗
4238,《将赴京师题孙处士山居二首》,83,秋，许浑自摄太平令任内擢为监察御史。将赴京上任，有诗二首题孙居士山居,841,诗
4239,《与张处士同访李隐居不遇》,83,在宣州，太平令任上，许浑与张处士同访李隐居不遇，有诗,841,诗
4240,《谢人赠鞭》,83,在宣州，太平令任上，许浑谢人赠鞭，有诗,841,诗
4241,《梁秀才以早春旅次大梁将归郊扉言怀兼别示亦蒙见赠凡二十韵走笔依韵》,83,在宣州，太平令任上，有诗和梁秀才,841,诗
4242,《晚自东郭回留一二游侣》,83,在宣州，晚自东郭回留一二游侣，许浑有诗一首,841,诗
4243,《寄澜公二首》,83,在歙州，与唐安寺僧清澜交往，有诗,894,诗
4244,《鲜于氏离堆记》,83,途经新政县遇故旧成都兵曹鲜于昱，因邀撰《鲜于氏离堆记》颂述其父鲜于仲通,760,文
4245,《新政县》,83,经新政县，有诗。,815,诗
4246,《请御书逍遥楼碑额表》,83,正书王屿铭于玄宗《登逍遥楼诗碑》后,760,文
4247,《倦夜》,83,夜中不能寐，见清夜之景，有感于心而作此诗,763,诗
4248,《薄暮》,83,至阆州，见暮景而伤情，作是诗。,763,诗
4249,《南池》,83,此讽巴蜀富而好巫,763,诗
4250,《阆州奉送二十四舅使自京赴任青城》,83,至阆州后遇崔二十四舅使蜀，随改命为青城令。送舅氏赴任，作是诗。,763,诗
4251,《王阆州筵奉酬十一舅惜别之作》,83,王阆州具酒饯别崔舅，舅有惜别之作，故公和之,763,诗
4252,《阆州东楼筵奉送十一舅往青城得昏字》,83,十一舅随二十四舅同往青城，公于阆州东楼设宴送行，并作是诗以送。,763,诗
4253,《放船》（送客蒼溪縣）,83,作是诗记放船之由，放船景事,763,诗
4254,《薄游》,83,薄游所见所感，叙景言情作是诗.,763,诗
4255,《严氏溪放歌行》,83,自伤旅况，叹时无知己；过严氏溪，欲与之偕隐。,763,诗
4256,《与严二归奉礼别》,83,时严盖入京师赴太常侍奉礼郎职，作是诗。,763,诗
4257,《赠裴南部闻袁判官自来欲有按问》,83,公之古人裴南部，被谗得罪，遣袁判官按问，公初至阆，故赠此诗,763,诗
4258,《对雨》,83,孤客天涯，所值吐蕃寇松、维、保三州，江边对雨，因而有诗,763,诗
4259,《愁坐》,83,吐蕃越过陇山，九月攻陷泾州，逼近京师。作诗特写忧惕之怀。,763,诗
4260,《警急》,83,题曰《警急》，畏边警之日急也,763,诗
4261,《王命》,83,题曰《王命》，望王朝之命将也,763,诗
4262,《征夫》,83,题曰《征夫》，伤征人之丧败也,763,诗
4263,《西山三首》,83,此因吐蕃之寇乱，而悲西民之疲于奔命也,763,诗
4264,《遣忧》,83,吐蕃陷长安后，闻代宗奔陕、长安宫室被焚掠之消息而作是诗。,763,诗
4265,《巴山》,83,在巴山西而慨朝事也,763,诗
4266,《江陵望幸》,83,长安陷后，传代宗欲到江陵，因作是诗。,763,诗
4267,《发阆中》,83,由阆归梓时所写途中情景,763,诗
4268,《早花》,83,此逢腊而遥寄蒙尘之叹,763,诗
4269,《岁暮》,83,是年底，吐蕃陷松、维、保三州，公忧乱而作也,763,诗
4270,《祭故相国清河房公文》,83,房琯遇疾，卒于阆州，作此文以祭,763,文
4271,《天边行》,83,此时边患情势急迫，归故乡洛阳不可能，胡羌逼近巴蜀，使杜甫不能不作出峡东去之准备。故作是诗。,764,诗
4272,《奉寄别马巴州》,83,将赴荆南，作是诗别马巴州。,764,诗
4273,《送李卿晔》,83,关心吐蕃陷长安，故作此诗。,764,诗
4274,《城上》,83,至阆州后，关心吐蕃陷长安代宗出奔，故作此诗。,764,诗
4275,《双燕》,83,托燕自喻，作是诗,764,诗
4276,《百舌》,83,此公因谗人变乱是非，易惑君听，而赋百舌以为比也,764,诗
4277,《伤春五首》,83,五首皆感春色而伤朝廷之乱也,764,诗
4278,《收京》,83,广德元年十月，郭子仪复京师，十二月车驾至陕州，时公在梓州，至次年而始闻其信，作是诗。,764,诗
4279,《巴西闻收京阙送班司马入京二首》,83,长安收复后，送故友班司马入京，作是诗。,764,诗
4280,《释闷》,83,代宗姑息程元振，杜甫闷怀不能释，作是诗以遣。,764,诗
4281,《有感五首》,83,吐蕃虽退，公复忧其致乱，作此惩前毖后之词,764,诗
4282,《阆山歌》,83,得闲周流于阆中山水之窟，作是诗。,764,诗
4283,《阆水歌》,83,得闲周流于阆中山水之窟，作是诗。,764,诗
4284,《陪王使君晦日泛江就黄家亭子二首》,83,陪阆州王刺史泛江就黄家亭，有感而作,764,诗
4285,《江亭王阆州筵饯萧遂州》,83,王刺史于江亭设宴，为遂州萧刺史饯行，杜甫陪宴而作。,764,诗
4286,《江亭送眉州辛驾升之得芜字》,83,江亭送眉州别驾辛升之，作是诗,764,诗
4287,《赠别贺兰铦》,83,代宗回京后作，公滞蜀，铦往吴，彼此离别，故至伤心，作是诗,764,诗
4288,《泛江》,83,公在阆州，因泛江而思长安也,764,诗
4289,《渡江》,83,得闲周流于阆中山水之窟，作是诗。,764,诗
4290,《暮寒》,83,此从乱离中追思太平盛世也,764,诗
4291,《游子》,83,杜甫早已计划东下，此时忽愁其所计不遂，因作是诗。,764,诗
4292,《滕王亭子二首》,83,在滕王阁吊滕王也,764,诗
4293,《玉台观二首》,83,游玉台观而作是诗。,764,诗
4294,《奉寄章十侍御》,83,是时章彝初罢梓州刺史东川留后之职，即将赴京师，杜甫因赋此诗以送。,764,诗
4295,《奉侍严大夫》,83,是年，严武复为成都尹兼剑南东川节度使，杜甫闻之大喜，因即放弃既定下峡之行期，决定待严武回任而归成都，作是诗歌。,764,诗
4296,《自阆州领妻子却赴蜀山行三首》,83,杜甫于暮春三月携其妻子回成都，途中作是诗。,764,诗
4297,《别房太尉墓》,83,公将赴成都，临行前去房琯坟前向故友诀别，作是诗以记之。,764,诗
4298,《为阆州王使君进论巴蜀安危表》,83,在阆州受到王刺史热情款待，代王刺史上表章一篇,764,表
4299,《阆州开元寺壁题乐天诗》,83,经阆州，游开元寺，题白居易诗于壁，有诗记之。白居易在江州，亦写元稹诗于屏风。,817,诗
4300,《游蜀》,83,三月暮，复至阆州，有诗,882,诗
4301,《嘉陵》,83,游观嘉陵江，有诗,882,诗
4302,《秋日登洪府滕王阁饯别序》,83,"重九日预都督府宴会,作《秋日登洪府滕王阁饯别序》及《滕王阁》诗",675,文
4303,《滕王阁》,83,"重九日预都督府宴会,作《秋日登洪府滕王阁饯别序》及《滕王阁》诗",675,诗
4304,自洪府舟行直书其事,83,南贬过洪州都督府，舟行抒怀,705,诗
4305,《忝官二十年尽在内职及为郡尝积恋因赋诗焉》,83,初夏，抵洪州任所，因恋内职而赋诗,727,诗
4306,《祭洪州城隍神文》,83,本月，亲祭洪州城隍神,727,文
4307,《荔枝赋并序》,83,又作荔枝赋并序，以寓身世之感,727,文
4308,《郡江南上别孙侍御》,83,是年在洪州有诗,727,诗
4309,《在郡秋怀二首》,83,是年在洪州有诗,727,诗
4310,《晨坐斋中偶而成咏》,83,是年在洪州有诗,727,诗
4311,《临泛东湖时任洪州》（郡庭日休暇）,83,是年在洪州有诗,727,诗
4312,《同藄毋学士月夜闻雁》,83,是年在洪州有诗,727,诗
4313,《后汉徴君徐君碣铭并序》,83,本年守洪州后，还拜谒了后汉高士徐穉墓，并亲撰碣铭以表景仰之情,727,文
4314,《秋晚登楼望南江入始兴郡路》,83,本年登城南楼有诗,727,诗
4315,《登城楼望西山》,83,本年登城楼望西山有诗,727,诗
4316,《郡府中每晨辄见群鹤东飞至暮又行列而返噥唳云路甚和乐焉予愧独处江城常目送此意有所羡遂赋以诗》,83,本年独处江城有诗,727,诗
4317,《故安南副都护毕公墓志铭并序》,83,本年为毕公撰墓志铭,727,文
4318,《祭故李常侍文》,83,本年祭故李长侍，有文,727,文
4319,《巡属县道中作》,83,在洪州刺史任。岁初，抵所属县乡及江州等地巡察,728,诗
4320,《岁初巡属县登高安南楼言怀》,83,在洪州刺史任。有登高安南楼言怀和巡属县道中作等诗,728,诗
4321,《洪州西山祈雨是日辄应因赋诗言事》,83,在洪州刺史任。又应当地民情风俗，在洪州西山祈雨，因有灵验而赋诗,728,诗
4322,《在洪州答藄毋学士》,83,在洪州刺史任。藄毋潜再次寄诗问候，九龄亦有诗作酬答,728,诗
4323,《开元正历握乾符颂并序》,83,在洪州刺史任。本月朝廷诏令《大衍历》颁行后，九龄作颂恭贺,728,文
4324,《答严给事书》,83,在洪州刺史任。春中，给事中严挺之致函九龄，劝其不必汲汲子声名，并约以淡泊无为之言。九龄遂有复函，坦陈全身远害之心迹,729,文
4325,《郡舍南有园畦杂树聊以永日》,83,在洪州刺史任。秋，在郡舍南园畦杂树间却步怀想，聊以永日，有诗纪之,729,诗
4326,《郡内闲斋》,83,在洪州刺史任。秋，复有郡内闲斋诗,729,诗
4327,《秋怀》,83,在洪州刺史任。秋，复有秋怀诗,729,诗
4328,《大唐故光禄大夫右散骑常侍集贤院学士赠太子少保东海徐文公神道碑》,83,在洪州刺史任。冬，应徐峻、徐峤、徐三兄弟之请，为其父徐坚撰神道碑,729,文
4329,《赠庆王友东平吕府君碑铭》,83,在洪州刺史任。为高力士夫人之祖吕处贞撰碑铭,729,文
4330,《戏题春意》,83,任洪州刺史至是年七月。春，有戏题春意诗,730,诗
4331,《洪州进白鹿表》,83,是年，洪州得白鹿，九龄表献之,730,文
4332,《秋夕望月》,83,在洪州任上。秋夕望月，有诗,730,诗
4333,《望月怀远》,83,在洪州任上。秋夕望月，有诗,730,诗
4334,《故辰州泸溪令赵公碣铭并序》,83,在洪州任上。在洪州，又应前任都督赵金穀之请托，为其父故辰州泸溪令赵公撰铭并序,730,文
4335,《至豫章南还江上作》,83,离洪州，有南还江上作,730,诗
4336,《九日龙沙作寄刘大慎虚》,83,游洪州等地，有诗寄刘慎虚,721,诗
4337,《豫章行》,83,寓家豫章，有诗,760,诗
4338,《江西送友人之罗浮》,83,寓家豫章，有诗赠友人,760,诗
4339,《对酒醉题屈突明府厅》,83,在建昌，有诗,760,诗
4340,哭张员外继,83,除刺史赴任过洪州，有诗哭友人,780,诗
4341,《为江淮都统使奏破刘展兵捷书表》,83,在淮南幕，正月，刘展之乱平，有为李峘奏破刘展兵捷表,761,文
4342,《为江淮都统使贺田神功平刘展表》,83,在淮南幕，正月，刘展之乱平，有贺田神功平刘展表,761,文
4343,《祭纛文》,83,在淮南幕，有文为李峘东归作,761,文
4344,《尚书右丞徐公写真图赞并序》,83,为会师平叛的庐州刺史徐浩写真图撰赞文,761,文
4345,《将还越留别豫章诸公》,83,离洪州归越，有诗赠友人,761,诗
4346,《唐故太子宾客兼御史大夫洪州都防御观察处置使平原郡开国公张公遗爱碑颂、洪州大云寺铜钟铭》,83,秋冬之间在洪州,764,文
4347,同陆太祝鸿渐崔法曹载华见萧侍御留后说得卫抚州报推事使张侍御却回前刺史戴员外无事喜而有作三首；萧侍御喜陆太祝自信州移居洪州玉芝观诗序,83,正月，戴叔伦坐谤被推案，会得澄清，和陆羽诗同为之庆,787,诗
4348,洪州西山风雨池记,83,六月大旱，李兼祈雨于洪州西山风雨池。八月，为之记,787,文
4349,祭外舅相国安平公文,83,九月，外舅崔造卒。十二月初，作文祭之,787,诗
4350,送灵澈上人庐山回归沃洲序,83,五月，在南昌送诗僧灵澈归沃州,788,文
4351,暮春陪诸公游龙沙熊氏清风亭诗序,83,三月，服阕还江西，与幕府同僚游龙沙熊氏清风亭,790,文
4352,次石头驿寄江西王十中丞阁老,83,冬，自袁州召返长安，途经豫章，宿石头驿，献诗于江西观察使王仲舒,820,诗
4353,《桄榔亭》,83,南行途中，至洪州，遇岭南使游徐孺亭看荷花，有题桄榔亭文,809,文
4354,《上江西李大夫书》,83,本年，入江西，投刺观察使李巽，作《上江西李大夫书》，以期叙用，未能遂愿,805,文
4355,《寄牛相公》,83,在洪州。江西幕中。正月，牛僧孺自武昌节度使召还守兵部尚书、同平章事，杜牧有诗寄之,830,诗
4356,《赠轩辕先生》（玉房花洞接三清）,83,在洪州开元寺研修《法华经》，时有诗送轩辕集归罗浮山,858,诗
4357,《赠轩辕先生》（曾亲文景上金銮）,83,在洪州开元寺研修《法华经》，时有诗送轩辕集归罗浮山,858,诗
4358,《春寄西山陈陶》,83,在洪州开元寺研修《法华经》，时与诗人陈陶交往，有诗,859,诗
4359,《上顾大夫》,83,在洪州开元寺，有诗,859,诗
4360,《山居诗二十四首》,83,复入洪州，居洪州西山，有诗,863,诗
4361,《别东林僧》,83,居洪州西山，有诗,863,诗
4362,《寄匡山大原和尚》,83,居洪州西山，有诗,863,诗
4363,《思匡山贾匡》,83,居洪州西山，有诗,863,诗
4364,《怀香炉峰道人》,83,居洪州西山，有诗,863,诗
4365,《别性空禅师》,83,居洪州西山，有诗,863,诗
4366,《秋末怀旧山》,83,居洪州西山，有诗,863,诗
4367,《冬末病中作二首》,83,居洪州西山，有诗,863,诗
4368,《上裴大夫二首》,83,居洪州西山，有诗,863,诗
4369,《春晚闲居寄陈嵩伯》,83,居洪州西山，有诗,864,诗
4370,《春晚书山家屋壁二首》（其一）,83,居洪州西山，有诗,864,诗
4371,《春晚书山家屋壁二首》（其二））,83,居洪州西山，有诗,864,诗
4372,《书陈处士屋壁二首》,83,居洪州西山，有诗,864,诗
4373,《赠钟陵陈陶处士》,83,居洪州西山，有诗,864,诗
4374,《寄西山胡汾》,83,居洪州西山，有诗,864,诗
4375,《送胡处士》,83,居洪州西山，有诗,864,诗
4376,《寄西山胡汾吴樵》,83,居洪州西山，有诗,864,诗
4377,《春末寄周琏》,83,居洪州西山，有诗,864,诗
4378,《归故林别知己》,83,离洪州前，有诗,864,诗
4379,《怀匡山长二首》,83,离洪州前，有诗,864,诗
4380,《寄匡山纪公》,83,离洪州前，有诗,864,诗
4381,《秋晚泊石头驿有寄》,83,秋离洪州,864,诗
4382,《再到钟陵作》,83,复到钟陵，有诗,870,诗
4383,《闻闵廷言周琏下第》,83,在钟陵，有诗,870,诗
4384,《江西再逢周琏》,83,在钟陵，有诗,870,诗
4385,《怀方干张为》,83,在钟陵，有诗,870,诗
4386,嘲钟陵妓云英（偶题）,83,至钟陵，再遇妓云英，有诗,871,诗
4387,钟陵见杨秀才,83,南下钟陵与杨寻相遇，有诗,875,诗
4388,贫居秋日,83,九月，干谒裴谟、裴坦兄弟，人洪州江西观察使，与裴氏兄弟有诗文酬唱,861,诗
4389,奉献致政裴秘监,83,九月，干谒裴谟、裴坦兄弟，人洪州江西观察使，与裴氏兄弟有诗文酬唱,861,诗
4390,秋叶有怀秋江晓望,83,冬，入江西观察使幕,861,诗
4391,旅舍除夜,83,冬，入江西观察使幕,861,诗
4392,《钟陵故人》,83,入京应举经南昌，有诗,891,诗
4393,《游峨眉山》,83,游峨眉，有诗,720,诗
4394,《峨眉山月歌》,83,游峨眉，有诗,724,诗
4395,《峨眉山》,83,游峨嵋，有诗,884,诗
4396,《秋日犍为道中》,83,离开蜀中，过戎州沿大江东区,884,未知
4397,《宿青溪驿，奉怀张员外十五兄之绪》,83,去成都经嘉州下忠、渝时所作，自蜀赴嘉，记宿溪情景，怀念遭贬的老友张之绪,765,诗
4398,《狂歌行赠四兄》,83,永泰夏去成都至嘉戎时作，喜兄弟相见，故兴至而狂歌,765,诗
4399,《初至犍为作》,83,夏，初至嘉州，有诗。,767,诗
4400,《登嘉州凌云寺做》,83,在嘉州，登凌云寺，有诗。,767,诗
4401,《上嘉州青衣山中峰题惠净上人幽居寄兵部杨郎中并序》,83,在嘉州，登青衣山，访惠净上人居所，题诗以识其事，并呈杨炎。,767,诗
4402,《峨眉东脚临江听猿怀二室旧庐》,83,在嘉州，于峨眉山脚临江听猿，思嵩山太室和少室旧居，有诗。,768,诗
4403,《江行夜宿龙吼滩临眺思峨眉隐者兼寄幕中诸公》,83,在嘉州，夜宿龙吼滩，思峨眉山隐者，有诗，兼寄剑南西川节度使幕府中诸公。,768,诗
4404,《秋夕听罗山人弹三峡流泉》,83,在嘉州，秋夕听罗山人弹《三峡流泉》曲，有诗。,768,诗
4405,《郡斋望江山》,83,在嘉州，于郡府望嘉州江山，有诗抒怀。,768,诗
4406,《咏郡斋壁画片云》,83,在嘉州，观郡府壁画云片，有诗。,768,诗
4407,《江行遇梅花之作》,83,居蜀中，江行遇梅花，有诗。,768,诗
4408,《东归发犍为至泥溪舟中作》,83,768年七月，自嘉州罢官东归，行舟至泥溪，有诗。,768,诗
4409,《荔枝》,83,能刺嘉州，有诗,866,未知
4410,《圣冈》,83,能刺嘉州，有诗,866,未知
4411,《凌云寺》,83,能刺嘉州，有诗,866,未知
4412,《边城作》《边城寓题》,83,能刺嘉州，有诗,866,未知
4413,《监郡犍为舟中寓题寄同舍》,83,能刺嘉州，有诗,866,未知
4414,《春日寓怀》《春霁》,83,是年春，能仍摄嘉州刺史，有诗,867,未知
4415,《初发嘉州寓题》,83,解嘉州刺史回成都，北还长安，有诗,867,未知
4416,《监郡犍为将归使府登楼寓题》,83,解嘉州刺史回成都，北还长安，有诗,867,未知
4417,《春日北归舟中有怀》,83,解嘉州刺史回成都，于北还长安途中有诗,867,未知
4418,《题净众寺古松》,83,不详,883,未知
4419,《改元大赦诏》,83,是年在长安，有文,618,文
4420,《即位告天册文》,83,即皇帝位于太极殿，大赦，改元,618,文
4421,《赐东乡同安敕》,83,是年在长安，有诏书,618,文
4422,《封隋帝为酅公诏》,83,是年在长安，有诏书,618,文
4423,《令陈直言诏》,83,是年在长安，有诏书,618,文
4424,《赐萧瑀手敕》,83,赐萧瑀手敕,618,文
4425,《选用前隋蔡王智积等子孙诏》,83,是年在长安，有诏书,618,文
4426,《军头军副更名诏》,83,是年在长安，有诏书,618,文
4427,《颁示孙伏加谏书诏》,83,是年在长安，有诏书,618,文
4428,《加恩隋公卿民庶诏》,83,是年在长安，有诏书,618,文
4429,《废隋代离宫别馆诏》,83,是年在长安，有诏书,618,文
4430,《皇子玄霸智云追封王制》,83,追封皇子玄霸智云王制,618,文
4431,《褒勋臣诏》,83,是年在长安，有诏书,618,文
4432,《赠李金才李敏官爵诏》,83,是年在长安，有诏书,618,文
4433,《赠高熲等谥爵诏》,83,是年在长安，有诏书,618,文
4434,《置社仓诏》,83,是年在长安，有诏书,618,文
4435,《阅武诏》,83,是年在长安，有诏书,618,文
4436,《减用牲牢诏》,83,是年在长安，有诏书,618,文
4437,《遣淮安王神通安抚山东诏》,83,是年在长安，有诏书,618,文
4438,《许李袭譽合谱宗正诏》,83,是年在长安，有诏书,618,文
4439,《罢贡异物诏》,83,是年在长安，有诏书,618,文
4440,《秦王太尉陜东行台制》,83,是年在长安，有诏书,618,文
4441,《给内外官禄制》,83,是年在长安，有诏书,618,文
4442,《给内外官职分田制》,83,是年在长安，有诏书,618,文
4443,《太子诸率府置骠骑将军车骑将军诏》,83,是年在长安，有诏书,618,文
4444,《赐李愍诏》,83,是年在长安，有诏书,618,文
4445,《县佐定员诏》,83,是年在长安，有诏书,618,文
4446,《禁行刑屠杀诏》,83,是年在长安，有诏书,619,文
4447,《初定租庸调法制》,83,是年在长安，有诏书,619,文
4448,《每州置宗师诏》,83,是年在长安，有诏书,619,文
4449,《大赦并浩等州诏》,83,是年在长安，有诏书,619,文
4450,《遣太子建成等巡畿甸诏》,83,是年在长安，有诏书,619,文
4451,《黎州总管曹国公徐世勣赐姓李氏诏》,83,是年在长安，有诏书,619,文
4452,《禁屠酤诏》,83,是年在长安，有诏书,619,文
4453,《命行人镇抚外藩诏》,83,是年在长安，有诏书,619,文
4454,《劳浩州刺史刘瞻书》,83,劳浩州刺史刘瞻书,619,文
4455,《赐许绍敕书》,83,赐许绍敕书,619,文
4456,《封王兰英为永寿郡君诏》,83,是年在长安，有诏书,619,文
4457,《秦王兼凉州总管制》,83,是年在长安，有诏书,619,文
4458,《曲赦凉甘等九州诏》,83,是年在长安，有诏书,619,文
4459,《旌表孝友诏》,83,是年在长安，有诏书,619,文
4460,《令国子学立周公孔子庙诏》,83,是年在长安，有诏书,619,文
4461,《修武備诏》,83,是年在长安，有诏书,619,文
