id,title,poet_id,content,year,genre
12496,《巫峡》,86,"秋冬,沿嘉陵江、长江,过三峡出蜀.再由江陵北上襄阳、南阳归洛阳.经三峡时有诗",688,诗
12497,《白帝城怀古》,86,出蜀赴京途中，过奉节，晚宿白帝城，有诗怀古,679,诗
12498,《早发白帝城》,86,流放夜郎，至夔州遇赦，喜出望外，立返江陵，有诗,759,诗
12499,《客堂》,86,追往事，叹身之衰,766,诗
12500,《引水》,86,因夔俗山居不能掘井，惟赖竹筒饮水而饮，蟠绕山腹间有至数百丈者，为此，杜甫遣仆人阿段走入深山，寻求水源，因而作此诗记之。,766,诗
12501,《示獠奴阿段》,86,因夔俗山居不能掘井，惟赖竹筒饮水而饮，蟠绕山腹间有至数百丈者，为此，杜甫遣仆人阿段走入深山，寻求水源，因而作此诗记之。,766,诗
12502,《寄韦有夏郎中》,86,韦有夏郎中奉使入蜀，以信来相告，因以诗寄之，作此诗。,766,诗
12503,《上白帝城》,86,夔州在三峡之间，山川形势，雄峻奇险，于初来之杜甫予以深刻印象，故作此诗。,766,诗
12504,《上白帝城二首》,86,夔州在三峡之间，山川形势，雄峻奇险，于初来之杜甫予以深刻印象，故作诗二首。,766,诗
12505,《陪诸公上白帝城头宴越公堂之作》,86,上白帝城，有长安来使同登而作是诗。,766,诗
12506,《白帝城最高楼》,86,游览白帝城，作是诗。,766,诗
12507,《武侯庙》,86,游览白帝城西郊之武侯庙，作是诗。,766,诗
12508,《八阵图》,86,游览夔州西南七里之八阵图，作此诗以吊古。,766,诗
12509,《古柏行》,86,咏武侯庙前之古柏，作是诗。,766,诗
12510,《负薪行》,86,夔州人民之生活，予甫以深刻印象。所见夔州许多女子，由于男丁缺少，年至四十五十犹未婚嫁，每日上山砍柴，负薪入市出卖，得钱供养一家，有时将钱买盐而归。时人不究原因，却言夔州女子貌丑，以致不能嫁丈夫，面对如此情况，杜甫作此诗反问之。,766,诗
12511,《最能行》,86,所见峡中男子，少数富者驾大舸经商，大多数贫者终身充当劳苦之船夫，时人皆言此乡之人器量窄小，只图眼前利益，杜甫作此诗以反诘之。,766,诗
12512,《为夔府柏都督谢上表》,86,代柏茂琳草拟之谢恩表,766,表
12513,《览物》,86,夏，在夔见巫峡、蜀江而思华洲，作是诗。,766,诗
12514,《忆郑南玭》,86,初居夔州，看峡景而想及华州郑县南之伏毒寺，矗立江中心之景，作是诗。,766,诗
12515,《赠崔十三评事公辅》,86,舅氏崔公辅，愿以评事出为外州幕僚，兹复以征荐入补羽林军职，道经夔州，与杜甫相会，别时以诗赠之。,766,诗
12516,《奉寄李十五秘书文嶷二首》,86,李十五，即李文嶷，累迁秘书省秘书郎，故称李秘书。时在云安，秋至夔州，杜甫有诗相赠。,766,诗
12517,《贻华阳柳少府》,86,华阳县柳少府客居夔州，因往访之，贻之以诗。,766,诗
12518,《雷》（大旱山岳燋）,86,是年夏甚热，而且久旱，至六七月尤甚，作是诗。,766,诗
12519,《热三首》,86,作诗以写炎蒸情景。,766,诗
12520,"《七月三日亭午已后，校热退,晚加小凉，稳睡有诗，因论壮年乐事，戏呈元二十一曹长》",86,元二十一，即元持，居夔州山阁学修炼之术，杜甫以诗戏之。,766,诗
12521,《火》,86,楚俗大旱则焚山击鼓，故作诗描写焚山情景。,766,诗
12522,《牵牛织女》,86,因所见而赋之。,766,诗
12523,《毒热寄简崔评事十六弟》,86,崔评事为甫诸舅之子，行第十六，奉使来夔，甫以毒热难堪，期以热退晤言，作是诗。,766,诗
12524,《信行远修水筒》,86,一日，林表山石崩，损坏云端之引水筒，致杜甫寓居缺水，隶人信行触热远修水筒，日暮方归，甫感而赋，特加慰恤。,766,诗
12525,《催宗文树鸡栅》,86,杜甫因患风痹，相传乌鸡可愈风疾，所以养鸡，故作此诗。,766,诗
12526,《驱竖子摘苍耳》,86,秋，为荒旱而作。竖子，乃童仆也。,766,诗
12527,《雨·万木云深隐》,86,有诗。,766,诗
12528,《种莴苣（并序）》,86,秋，杜甫到夔州，初期生活之写照，借莴苣抒发胸中愤郁之情。,766,诗
12529,《雨·峡云行清晓》,86,久热之余忽然得雨，作是诗。,766,诗
12530,《雨·行云递崇高》,86,隔数日，又雨，因复作此诗。,766,诗
12531,《雨二首》,86,深秋久雨，作诗二首。,766,诗
12532,《雨不绝》,86,《雨二首》写断续之骤雨，既而骤雨之后，有绵绵之小雨不绝，因复作此诗。,766,诗
12533,《晚晴》（返照斜初徹）,86,雨后晚晴，作是诗。,766,诗
12534,《殿中杨监见示张旭草书图》,86,殿中监杨某赴蜀见杜鸿渐，因鸿渐是时辟杨为蜀中郡守，道经夔州，晤及杜甫，出示张旭草书图，杜甫以诗题之。,766,诗
12535,《杨监又出画鹰十二扇》,86,又出示画鹰十二扇，杜甫以诗题之。,766,诗
12536,《送殿中杨监赴蜀见相公》,86,送别杨监，作是诗。,766,诗
12537,《赠李十五丈别》,86,是时李秘书文嶷将适洪州访江西观察使李勉，勉亦宗室，肃宗初，尝为梁州都督，后历河南尹，而是时则徙江西观察使未久，故李十五秘书欲取道黔阳往江西，临别，杜甫赠之以诗。,766,诗
12538,《白盐山》,86,白盐山，在重庆奉节县东长江瞿塘峡夔门南岸。秋，作是诗。,766,诗
12539,《滟滪堆》,86,滟滪堆，古又称淫预、淫豫、犹与，又俗称燕窝石，为长江江心突起之巨石，在今重庆市奉节县东五里瞿塘峡口，旧时为长江三峡中著名之险滩，新中国建立后，为便利交通，已将其炸掉。秋，作是诗。,766,诗
12540,《白帝》,86,白帝，指白帝城。崔旰之乱，借白帝雨景，叹夔民之苦难。,766,诗
12541,《黄草》,86,黄草，峡名，一曰黄葛峡，在今重庆市长寿区江上，因山上多黄草，故称。蜀中兵乱，即崔旰之乱，作是诗。,766,诗
12542,《夔州歌十绝句》,86,秋，作诗，言夔州形胜，兼及时事，中藏讽刺。,766,诗
12543,《诸将五首》,86,秋，有诗。追怀过去之经历，已往所处之时代以及所经之变乱，对当时君臣将帅，念念不忘规劝之意。,766,诗
12544,《夜》（露下天高秋水清）,86,秋，寓居西阁，记述夜晚所见所闻，怀念长安，作是诗。,766,诗
12545,《秋兴八首》,86,秋，杜甫身居夔州，心忆长安，遣兴而作。,766,诗
12546,《咏怀古迹五首》,86,借古迹以咏怀。,766,诗
12547,《听杨氏歌》,86,有诗。,766,诗
12548,《宿江边阁》,86,秋，移寓夔州之西阁，作是诗。,766,诗
12549,《西阁雨望》,86,有诗。,766,诗
12550,《西阁二首》,86,晚秋，作诗以抒怀。,766,诗
12551,《西阁夜》,86,秋，作是诗，乃独夜感时之作。,766,诗
12552,《西阁三度期大昌严明府同宿不到》,86,冬，作是诗，责严明府之失期，望其践约而到西阁。,766,诗
12553,《覆舟二首》,86,秋，所见采买丹药之使者经峡江时所覆之舟，作诗二首。,766,诗
12554,《奉汉中王手札》,86,秋，汉中王李瑀，贬蓬州刺史，以路梗不得归京，今将出峡，作书告知，甫因复之以诗。,766,诗
12555,《奉汉中王手札报韦侍御萧尊师亡》,86,秋，杜甫得汉中王手书，报韦侍御萧尊师已俱殁，作是诗。,766,诗
12556,《存殁口号二首》,86,卫侍御与萧尊师二人，乃杜甫自儿时既与之相交者。因萧韦俱逝，而念及故交日益减少。故交之中，有席谦，吴人，善弹棋；毕曜善为小诗，已死；郑虔之诗、书、画，玄宗尝称之为三绝，亦已死；曹霸善画马，尚存。念此四人皆游于艺而至今或存或亡，因作诗二首。,766,诗
12557,《月圆》,86,杜甫在西阁见月圆而有所感，作是诗。,766,诗
12558,《中宵》,86,半夜难以入眠，感慨兵事连连，起床独步，感慨而作是诗。,766,诗
12559,《不寐》,86,伤时事之乱而作是诗。,766,诗
12560,《远游》（江闊浮高棟）,86,有诗。,766,诗
12561,《垂白》,86,秋，作是诗。,766,诗
12562,《雨晴》（雨時山不改）,86,峡中雨晴之景，生思乡之念，作是诗。,766,诗
12563,《摇落》,86,秋，作是诗。,766,诗
12564,《草阁》,86,有诗。,766,诗
12565,《江月》,86,有诗。,766,诗
12566,《江上》,86,有诗。,766,诗
12567,《中夜》,86,有诗。,766,诗
12568,《遣愁》,86,有诗。,766,诗
12569,《九日诸人集于林》,86,忆往时京师重阳节之事。,766,诗
12570,《返照》（楚王宮北正黃昏）,86,赋雨后晚景兼自叹，作是诗。,766,诗
12571,《吹笛》,86,闻笛而有感，作是诗。,766,诗
12572,《秋日寄题郑监湖上亭三首》,86,杜甫知郑虔之侄郑审以秘书少监谪居江陵，郑审在江陵湖边新筑一宅，来函索甫题诗，作诗三首。,766,诗
12573,《八哀诗》,86,由于追念往事，遂追怀与自己同时代之人物及其事迹，其中有生平钦佩之前辈张九龄、李邕，有当代名将王思礼、李光弼，有于己曾有极大匡助之李琎、严武，有生平最亲切而毫无间隔之好友郑虔、苏源明，八人集在一起，写成八首长诗。,766,诗
12574,《壮游》,86,统说生平游历胜处。,766,诗
12575,《昔游》（昔者與高李）,86,追述东游宋、齐时事，以致今昔之感。,766,诗
12576,《遣怀》（昔我遊宋中）,86,追述往事，遣怀故友，感慨时事之作。,766,诗
12577,《往在》,86,伤京都两为戎狄所陷，自身漂泊，不获归老而作。,766,诗
12578,《谒先主庙》,86,先主，即蜀汉昭烈帝刘备，杜甫游览奉节城东白帝山上之先主庙，作是诗。,766,诗
12579,《夔府书怀四十韵》,86,杜甫居夔州，作是诗以抒怀，叙其初赐官逢崔旰之乱，而避乱至此，伤时忧国。,766,诗
12580,《送李功曹之荆州充郑侍御判官重赠》,86,送李功曹到荆州，此云重赠，是先有赠诗，今集中已逸去，谓在夔生涯值年老迟暮，故欲出峡，遥望荆州水国，心向往而不能至，作是诗。,766,诗
12581,《哭王彭州抡》,86,时彭州刺史王抡卒于任所，尝有诗哭之，今榇过夔州，作是诗，追叙王抡生前死后诸多事情，也包含诗人留滞夔州的感伤心情。,766,诗
12582,《偶题》,86,秋，作是诗。先论诗学源流和对诗歌的见解及创作经验，次叹己之诗学未能传于子孙，以下又感慨客居夔州情事，并叹藩镇割据，国家动荡，最后以怀念故园作结。,766,诗
12583,《赠高式颜》,86,是时，在夔州与高适之族侄高式颜相遇，作是诗。,766,诗
12584,《李潮八分小篆歌》,86,秋，杜甫与善书小篆与八分之李潮在夔州相逢，李潮为杜甫之甥，求以诗相赠，故作此诗。,766,诗
12585,《峡口二首》,86,秋，作是诗。首章咏叹瞿塘峡形胜地险，寄托了诗人伤时叹乱的感慨。次章则追溯往事，言形胜之盛衰，皆因人事，兼陈客夔景况，有愧人情。,766,诗
12586,《南极》,86,冬，作是诗。久居南方，有感于南方山水、风景、人物、时事而作此诗，流露出不愿久居南土的情绪。,766,诗
12587,《送王十六判官》,86,是时蜀客避崔旰之乱，尽下荆南，王十六先到荆南，即为地主，请于江陵城北觅得荒林间之庾信宅时，望为留下，因杜甫亦欲下峡卜居江陵，作是诗。,766,诗
12588,《瞿唐两崖》,86,冬，作是诗。,766,诗
12589,《瞿塘怀古》,86,有诗。,766,诗
12590,《夜宿西阁，晓呈元二十一曹长》,86,元二十一曹长，或谓元持。曹长，尚书丞、郎、郎中相呼之称谓。杜甫曾与元同曹，故称。诗先写与元曹长同宿西阁时所见夜景，次写雨雪初霁时所见晓景，最后道出出峡之意。,766,诗
12591,《西阁口号呈元二十一》,86,冬日，元二十一来访于西阁，作是诗。记诗人与元曹长共话国事情事，表现了诗人对国家命运的深切关注。,766,诗
12592,《阁夜》,86,西阁雪霁后，作是诗。诗写阁夜所见所闻景象，悲壮动人。,766,诗
12593,《瀼西寒望》,86,柏茂琳闻杜甫有离夔之意，极力劝阻之。知其不欲久居西阁险阻之区，且厌城市烦嚣，欲就平旷闲静之地，可资耕种者，觅一草屋居之，亦较城市为便，遂为杜甫言州西之西瀼溪有柑林四十亩，系公地，且有草屋可居；又州东之东瀼溪（今奉节梅溪河）两岸有公田百顷，据说公孙述曾于此屯田，地名东屯，可资耕种；此两地任凭选择。因此，杜甫乘兴至瀼西一观，作是诗。,766,诗
12594,《白帝楼》,86,白帝楼，故址在今重庆奉节白帝山白帝城中。杜甫登临此楼，表达了登高思归的心情。,766,诗
12595,《白帝城楼》,86,作是诗，写登白帝城楼见到的自然景观，寄托了出峡之思。,766,诗
12596,《西阁曝日》,86,西阁雪霁后，栩栩如生地刻画出自己在西阁晒太阳得情景，触景感叹聚乐散哀，又自叹无力忧世。,766,诗
12597,《不离西阁二首》,86,预计春后下峡北归，作诗记之。,766,诗
12598,《为夔府柏都督谢上表》,86,代柏茂琳草拟之谢恩表。,766,表
12599,《览柏中丞兼子侄数人除官制词，因述父子兄弟四美，载歌丝纶》,86,时柏茂琳之弟及子侄数人皆除官，柏以其子弟除官制词出示杜甫，杜甫作是诗。,766,诗
12600,《览镜呈柏中丞》,86,冬，时柏茂琳有罗致杜甫之意，杜甫以衰谢辞之，故作是诗。,766,诗
12601,《陪柏中丞观宴将士二首》,86,柏中臣（茂琳）宴请将士，邀请杜甫与宴作陪，杜甫作诗二首。第一首记宴会之盛；第二首称美柏中臣，并望其将来有所升迁。,766,诗
12602,《奉送蜀州柏二别驾将中丞命，赴江陵起居卫尚书太夫人，因示从弟行军司马位》,86,时柏茂琳遣其二弟，赴江陵问候荆南节度使检校工部尚书卫伯玉的母亲，杜甫以诗送之，并寄示从弟杜位，因杜位时为荆南节度使之行军司马。,766,诗
12603,《荆南兵马使太常卿赵公大食刀歌》,86,荆南兵马使赵太常驻白帝城，于宴会中示杜甫以大食国刀，杜甫为之作歌。,766,诗
12604,《王兵马使二角鹰》,86,王兵马使，亦承荆南节度使卫伯玉之命，治兵来夔，王兵马使军帐中养二角鹰，请杜甫赋之，因亦作歌行一首。,766,诗
12605,《见王监兵马使说，近山有白黑二鹰，罗者久取，竟未能得。王以为毛骨有异他鹰，恐腊后春生，鶱飞避暖，劲翮思秋之甚，眇不可见，请余赋诗二首》,86,王兵马使听说附近山上有白黑二鹰，毛骨殊众，捕罗之人久未捕获，怕腊后春生，避暖飞走，于是就请杜甫赋诗以纪其事。其一咏白鹰，状其英决机智；其二咏黑鹰，写其飞来之远和飞去之速。,766,诗
12606,《缚鸡行》,86,岁暮有见于小奴缚鸡往市头发卖，鸡被卖出则遭杀烹之祸，念之心有不忍；在家见鸡啄虫蚁而食，念及虫蚁被食，亦心有不忍，作是诗。,766,诗
12607,《折槛行》,86,时闻鱼朝恩在朝横恣，且判国子监事，而集贤待制诸臣，噤口不一纠正，因作是诗以讥之。,766,诗
12608,《立春》,86,在夔州，立春日忆及昔在东西两京时，朋友亲戚间以春饼生菜为盘，号曰春盘，互相馈赠，因作是诗。抒发了节气依旧而盛世难再的深沉感慨：既悲一身之漂泊，更悲两京之萧索，写得神情流动，一往情深。,767,诗
12609,《江梅》,86,见江梅，作是诗。,767,诗
12610,《庭草》,86,见庭草，作是诗。,767,诗
12611,《晓望白帝城盐山》,86,初春，写晓望白盐山之美景，现出诗人心境之明朗愉悦。,767,诗
12612,《王十五前阁会》,86,杜甫扶病赴客，主人馈食以归之作。,767,诗
12613,《老病》,86,春，杜甫发病，作是诗。抒发了诗人久滞异地的感慨，并透露出希望回朝供职、重蒙皇恩的心愿。,767,诗
12614,《崔评事弟许相迎不到，应虑老夫见泥雨怯出，必愆佳期，走笔戏简》,86,晚春，病稍好，崔评事来西阁相访，并约定宴饮之期以马来迎，却居期不到，因以诗简之。,767,诗
12615,《愁》,86,有诗。,767,诗
12616,《昼梦》,86,有诗。,767,诗
12617,《遣闷戏呈路十九曹长》,86,雨天独处无聊，戏作小诗向友人索酒，藉以遣闷，作是诗。,767,诗
12618,《晴二首》,86,春，作是诗。,767,诗
12619,《雨·始贺天休雨》,86,二、三月间，作是诗。,767,诗
12620,《怀灞上游》,86,有诗。,767,诗
12621,《晨雨》,86,有诗。,767,诗
12622,《入宅三首》,86,暮春之初，杜甫一家由西阁迁居赤甲，其中向使者一一询问函关事，即周智光据华州反事。,767,诗
12623,《赤甲》,86,春，迁居赤甲时所作。,767,诗
12624,《暮春》,86,有诗。,767,诗
12625,《即事·暮春三月巫峡长》,86,有诗。,767,诗
12626,《卜居》（歸羨遼東鶴）,86,在迁居赤甲之后，柏茂琳以瀼西四十亩柑林见赠，并赁得漕廨所属之草屋可居，因又迁居瀼西。作是诗。,767,诗
12627,《暮春题瀼西新赁草屋五首》,86,杜甫由赤甲迁到瀼西，作是诗。,767,诗
12628,《江雨有怀郑典设》,86,郑典设者，尝为东宫点设郎，是时居穰东，与杜甫在夔有往还，今杜甫迁瀼西，与之相隔一溪，值江雨，作是诗。,767,诗
12629,《熟食日示宗文宗武》,86,在熟食日，即寒食节，作是诗。诗人流寓夔州，不能回洛阳祭扫祖坟，又想到自己年老多病，行将成为松柏中人，所以禁不住感恨伤悲。,767,诗
12630,《又示两儿》,86,在熟食日，即寒食节作是诗，怀念在河南许州长葛县之弟与江西江州之妹，亦自伤己之将殁。,767,诗
12631,《得舍弟观书，自中都已达江陵。今兹暮春月末，行李合到夔州，悲喜相兼，团圆可待，赋诗即事，情见乎词》,86,忽得三弟杜观书，云自中京（即长安，至德二载西京改为中京）已到江陵，即当到夔与兄团圆，喜而赋诗。,767,诗
12632,《喜观即到，复题短篇二首》,86,忽得三弟杜观书，云自中京（即长安，至德二载西京改为中京）已到江陵，即当到夔与兄团圆，喜而赋诗。,767,诗
12633,《送惠二归故居》,86,在夔与当地隐逸之士惠二相交，作是诗。,767,诗
12634,《寄薛三郎中据》,86,是时，闻昔在长安同登慈恩寺塔之尚书郎薛据旅居荆州，将北归京师，杜甫闻讯而赠此诗。,767,诗
12635,《晚登瀼上堂》,86,一日，登瀼上之野堂远眺，作是诗。,767,诗
12636,《醉为马坠，群公携酒相看》,86,一日，赴柏茂琳宴，酒后骑马而归，自白帝城门驰下瞿唐时坠马受伤，群公闻之，复携酒想看，因作是诗。,767,诗
12637,《承闻河北诸路道节度入朝欢喜口号绝句十二首》,86,在此暮春月末，闻正月淮南节度使李忠臣入朝，三月汴宋节度使田神功入朝，八月凤翔等道节度使李抱玉入朝，并传闻河北诸道节度使入朝，不觉大喜，认为是唐室恢复统一之征象，因作诗十二首。,767,诗
12638,《过客相寻》,86,迁居瀼西后，除前面所言群公携酒想看外，时有过客相继前来，此时有比较安定之生活，杜甫用园果及溪鱼相招待，作是诗。,767,诗
12639,《竖子至》,86,柑林离杜甫草屋尚有一段距离，仆人摘果后，须提携而至。此诗为阿段自柑园摘熟李而至之情景。,767,诗
12640,《园》,86,有诗。,767,诗
12641,《归》,86,夏，从瀼西小园中归家而作。,767,诗
12642,《园官送菜》,86,夏，柏茂琳命官园中园吏经常以菜把送给杜甫，但常阙而又少嘉蔬。徒有送菜之名，杜甫因借此事以推论世道，伤小人妒害君子，而作是诗颂扬柏茂琳。,767,诗
12643,《园人送瓜》,86,夏，有诗。,767,诗
12644,《课伐木》,86,时届长夏，于率领诸仆养果种疏之外，并督理伯夷辛秀信行等人入谷伐木，早出暮返，借以补筑藩篱，以防虎患，作是诗。,767,诗
12645,《柴门》,86,以事出游于山峡间，傍晚舟回瀼西，作是诗以纪之。,767,诗
12646,《槐叶冷淘》,86,以槐芽槐叶之汁和面，做成面条，煮好后放入凉汤，拌以佐料食用，名曰槐叶冷淘，作是诗以美之。,767,诗
12647,《上后园山脚》,86,因避炎热，特择一清晨，上后园之高岑，远望散襟，作是诗，有感于自己历年跋涉道路，至老尚不得归。,767,诗
12648,《奉送王信州崟北归》,86,时夔州守王崟归京师，作是诗。,767,诗
12649,《月三首》,86,六月初旬，作诗。,767,诗
12650,《送十五弟侍御使蜀》,86,有十五弟为侍御，奉命使蜀，经夔州而来，因以诗赠其别。言自恨不能身讨蜀中乱贼，望其弟于归朝后弹击之。,767,诗
12651,《舍弟观归蓝田迎新妇，送示二篇》,86,杜观于三月末四月初前来省亲，今须归蓝田迎新妇，杜甫因送以诗二首。,767,诗
12652,《季夏送乡弟韶陪黄门从叔朝谒》,86,六月杜鸿渐还朝，有同姓弟杜韶陪之而行，作是诗，此时，杜韶兼开江使，通成都外江下峡舟船。,767,诗
12653,《滟滪》,86,时乘兴暂往白帝城一行，赋此诗，写雨后江水复涨时所见滟滪之景。,767,诗
12654,《行官张望补道畦水归》,86,峡中种稻，六月间必加以灌溉，杜甫交行官张望管理之东屯田亩，既已插秧，则须补水，其事亦在杜甫关照中，因而有此诗。,767,诗
12655,《七月一日题终明府水楼二首》,86,七月一日，奉节县终明府相邀会与县署之水楼，作诗二首。,767,诗
12656,《秋行官张望督促东渚耗稻向毕，清晨遣女奴阿稽、竖子阿段往问》,86,秋，行官张望督促东屯耗稻，杜甫遣女仆阿稽，竖子阿段往问，作是诗纪之。,767,诗
12657,《阻雨不得归瀼西甘林》,86,既至白帝城后，杜甫为雨所阻，不得归瀼西柑林，作是诗。,767,诗
12658,《又上后园山脚》,86,秋，及雨止，既归柑林，又上后园山脚，登高望远，忽忆及昔游山东，登泰山东南岩日观峰情事，因赋诗追述当时安禄山方强于范阳，中经丧乱，至今干戈未定，已身漂泊无所归。,767,诗
12659,《甘林》,86,归柑林，作是诗。,767,诗
12660,《暇日小园散病，将种秋菜，督勒耕牛，兼书触目》,86,暇日扶病至小园督种秋蔬，作是诗。,767,诗
12661,《雨·山雨不作泥》,86,有诗。,767,诗
12662,《秋风二首》,86,有诗。,767,诗
12663,《见萤火》,86,有诗。,767,诗
12664,《溪上》,86,记瀼西茅屋形势风土，并写客居之怀。,767,诗
12665,《树间》,86,有诗。,767,诗
12666,《白露》,86,前往检查柑园所作。,767,诗
12667,《诸葛庙》,86,游览诸葛庙，追记武侯身前事迹，作诗以记之。,767,诗
12668,《夜雨》,86,秋，有诗。,767,诗
12669,《更题》,86,秋，有诗。,767,诗
12670,《第五弟丰独在江左，近三四载寂无消息，觅使寄此二首》,86,第五弟丰，独在江左，近三四载寂无消息，觅使寄诗二首。,767,诗
12671,《赠李八秘书别三十韵》,86,杜鸿渐于六月还朝后，留京仍以同平章事兼领山南剑南副元帅，以书至成都招李八秘书入幕。先是李八秘书自凤翔扈从肃宗复国时，与杜甫同朝，其后又曾访杜甫于夔州，今李八由成都经夔府赴京入杜鸿渐幕，杜甫以此诗送之。,767,诗
12672,《送李八秘书赴杜相公幕》,86,杜鸿渐于六月还朝后，留京仍以同平章事兼领山南剑南副元帅，以书至成都招李八秘书入幕。先是李八秘书自凤翔扈从肃宗复国时，与杜甫同朝，其后又曾访杜甫于夔州，今李八由成都经夔府赴京入杜鸿渐幕，杜甫以是诗赠之。,767,诗
12673,《别李秘书始兴寺所居》,86,此李秘书为李十五秘书，即李文嶷，居夔州始兴寺静修，杜甫往返之后，作是诗。,767,诗
12674,《君不见，简苏徯》,86,时有故人之子苏徯亦沦落在夔州，杜甫作是诗。,767,诗
12675,《赠苏四徯》,86,苏徯自蜀赴湖南，杜甫复赠以诗。,767,诗
12676,《别苏徯》,86,苏徯赴湖南幕，杜甫因作是诗。,767,诗
12677,《别崔潩因寄薛据、孟云卿》,86,崔潩，清河东武城（今属山东）人，杜甫表弟，时赴湖南幕任从事兼监察御史，杜甫作诗送别。,767,诗
12678,《巫峡敝庐奉赠侍御四舅别之澧朗》,86,杜甫之侍御四舅，因携家避乱，将于澧州（今澧县）郎州（今常德县）二郡中择一以处。杜甫久居于夔，颇得安居，舅氏寄寓数日，与杜甫谋及卜居之地，作是诗。,767,诗
12679,《孟氏》,86,闲中过近邻孟十二仓曹及孟十四主簿兄弟之宅，作是诗。,767,诗
12680,《吾宗》,86,赠卫仓曹杜崇简，作是诗。,767,诗
12681,《奉酬薛十二丈判官见赠》,86,时有薛十二判官，新娶一妇，寄诗与杜甫以自明，杜甫因回诗奉赠，作是诗。,767,诗
12682,《寄狄明府》,86,狄博济，狄仁杰曾孙，杜甫姨表弟，曾为县令，不得志，往来泯汉间干谒藩镇，杜甫闻之，以诗寄之。,767,诗
